<?xml version="1.0" encoding="UTF-8"?>
<!ELEMENT richiesteGestore (richiesta+)>
<!ELEMENT richiesta (username, data, status)>
<!ELEMENT username (#PCDATA)>
<!ELEMENT data (#PCDATA)>
<!ELEMENT status (#PCDATA)>
